hypothesis_id,hypothesis_name,evidence_strength,supporting_evidence,contradicting_evidence,missing_evidence,interpretation_status
H1,rain_band_spatial_reorganization,strong,Meiyu share decreased (-0.028). South/SCS share increased (0.028).,,Manual review of precip maps is still recommended.,partially_supported
H2,V_component_shift_strength_to_NSdiff_or_position,strong,V_strength abs response early/late=1.32/0.962; V_NS_diff=1.72/1.66. V_strength weakens while V_NS_diff is retained/stronger.,,Needs physical interpretation of V composite patterns.,partially_supported
H3,T3_internal_state_mixing_dilution,strong,14/21 V→P pairs changed early/late profile type; 17 dilution-like pairs.,,Needs regional/spatial confirmation that early and late T3 correspond to different physical states.,partially_supported
H4,P_target_component_shift,strong,"Mainband late positive=0.144, change=-0.071; spread/centroid/south late positive=0.303, change=-0.078. Target shifts away from mainband toward spread/centroid/south. Index validity context: 10/10 listed P/V indices are strong where available.",,Needs manual map review for P target component composite structure.,partially_supported
H5,synchronous_multi_family_reorganization,moderate,4/20 family-directions lower stable fraction at T3; 0/20 higher tau0-coupled fraction.,,Needs spatial/object-field confirmation; this table only uses V1 stability counts.,partially_supported
